{
  "Id": 100,
  "Name": "Example Name",
  "ValueType": "Text",
  "StringValue": "example-value",
  "IntValue": 73,
  "BoolValue": true,
  "CredentialUsername": "Example Name",
  "CredentialPassword": "example-value",
  "Description": "Example description for this resource.",
  "OrganizationUnitId": 26
}